{
  "adapter": "rust-cargo",
  "contractVersion": "KILN-COAL-CONTRACT-1",
  "execution": {
    "appendEntry": false,
    "driver": "command",
    "entryKind": "none",
    "environment": {
      "CARGO_TERM_COLOR": "never"
    },
    "rebuildCommands": [
      [
        "cargo",
        "build",
        "--locked",
        "--tests"
      ]
    ],
    "testCommand": [
      "cargo",
      "test",
      "--locked",
      "--workspace"
    ]
  },
  "languages": [
    "rust"
  ],
  "mutation": {
    "rules": [
      {
        "ignoreCase": false,
        "kind": "RUST_TOKEN_REPLACEMENT",
        "pattern": "\\bfalse\\b|\\btrue\\b|!=|==|&&|\\|\\|",
        "replacements": {
          "!=": "==",
          "&&": "||",
          "==": "!=",
          "false": "true",
          "true": "false",
          "||": "&&"
        }
      }
    ],
    "strategy": "text-rules"
  },
  "proof": {
    "assertionPatterns": [
      "\\bassert!\\s*\\(",
      "\\bassert_eq!\\s*\\("
    ],
    "locationPatterns": [
      "at (?P<path>[^:\\r\\n]+\\.rs):(?P<line>\\d+):\\d+"
    ],
    "parser": "generic",
    "testPatterns": [
      "^test (?P<test>[^ ]+) \\.\\.\\. FAILED$"
    ]
  },
  "schema": "kiln.coal-contract.v1",
  "sourceExtensions": [
    ".rs"
  ]
}
